{
  "profile_version": "0.1.0",
  "product": "wasurezu",
  "owner_repo": "watchout/agent-memory",
  "source_refs": [
    "https://github.com/watchout/agent-memory/issues/120",
    "src/index.ts",
    "docs/design/core/SSOT-3_API_CONTRACT.md",
    "docs/design/core/SSOT-6_LIVING_MEMORY_CONTROL.md",
    "iyasaka-arc/cross-cutting/specs/draft/2026-06-02-governed-action-surface-profile.md"
  ],
  "surfaces": [
    {
      "surface_id": "wasurezu.log_decision",
      "surface_type": "mcp_tool",
      "display_name": "log_decision",
      "description": "Persist an architectural or operational decision.",
      "capability_classes": [
        "write"
      ],
      "risk_level": "medium",
      "boundary": {
        "standalone_required": true,
        "state_owner": "wasurezu",
        "execution_owner": "wasurezu",
        "policy_owner": "wasurezu",
        "audit_owner": "wasurezu",
        "interop_modes": [
          "none"
        ],
        "allowed_dependencies": [],
        "forbidden_dependencies": [
          "direct_db_write",
          "shared_internal_state",
          "shared_credentials"
        ],
        "direct_db_access_to_other_products": false,
        "receiving_product_revalidates": false
      },
      "resource_scope": {
        "tenant_scoped": false,
        "resource_patterns": [
          "decision",
          "project"
        ],
        "data_categories": [
          "decision_memory"
        ]
      },
      "identity_requirements": {
        "actor_required": true,
        "agent_id_required": true,
        "human_user_required": false,
        "service_account_allowed": true
      },
      "context_requirements": {
        "context_pack_required": false,
        "required_labels": [],
        "denied_labels": [
          "private_reasoning"
        ],
        "prompt_injection_check_required": false
      },
      "memory_requirements": {
        "recovery_pack_required": false,
        "approval_note_required": false,
        "human_intent_ref_required": false
      },
      "approval_policy": {
        "approval_required": false,
        "approver_role": null,
        "approval_ttl_seconds": null,
        "reuse_allowed": false
      },
      "audit_policy": {
        "audit_required": true,
        "input_summary_required": true,
        "output_summary_required": true,
        "mutation_summary_required": true,
        "egress_summary_required": false,
        "redaction_required": true
      },
      "rollback_policy": {
        "rollback_required": false,
        "rollback_kind": "compensating_action",
        "replay_supported": false
      },
      "execution_policy": {
        "dry_run_supported": false,
        "idempotency_key_required": false,
        "rate_limit_policy": null,
        "timeout_seconds": null
      },
      "notes": "reveal_behavior=does_not_reveal_stored_memory | conditional_approval=required only if an external policy marks the decision category as governed | audit_summary_fields=actor,agent_id,project,decision_summary,tags,decision_id | redaction_requirements=redact_secrets_before_output,do_not_store_private_reasoning | retention_requirements=supersession_preserves_history"
    },
    {
      "surface_id": "wasurezu.get_decisions",
      "surface_type": "mcp_tool",
      "display_name": "get_decisions",
      "description": "Read stored decisions by project, tag, limit, and status.",
      "capability_classes": [
        "read",
        "reveal"
      ],
      "risk_level": "medium",
      "boundary": {
        "standalone_required": true,
        "state_owner": "wasurezu",
        "execution_owner": "wasurezu",
        "policy_owner": "wasurezu",
        "audit_owner": "wasurezu",
        "interop_modes": [
          "none"
        ],
        "allowed_dependencies": [],
        "forbidden_dependencies": [
          "direct_db_write",
          "shared_internal_state",
          "shared_credentials"
        ],
        "direct_db_access_to_other_products": false,
        "receiving_product_revalidates": false
      },
      "resource_scope": {
        "tenant_scoped": false,
        "resource_patterns": [
          "decision",
          "project",
          "tag",
          "status"
        ],
        "data_categories": [
          "decision_memory"
        ]
      },
      "identity_requirements": {
        "actor_required": true,
        "agent_id_required": true,
        "human_user_required": false,
        "service_account_allowed": true
      },
      "context_requirements": {
        "context_pack_required": false,
        "required_labels": [
          "project_scope"
        ],
        "denied_labels": [
          "private_reasoning"
        ],
        "prompt_injection_check_required": false
      },
      "memory_requirements": {
        "recovery_pack_required": false,
        "approval_note_required": false,
        "human_intent_ref_required": false
      },
      "approval_policy": {
        "approval_required": false,
        "approver_role": null,
        "approval_ttl_seconds": null,
        "reuse_allowed": false
      },
      "audit_policy": {
        "audit_required": true,
        "input_summary_required": true,
        "output_summary_required": true,
        "mutation_summary_required": false,
        "egress_summary_required": false,
        "redaction_required": true
      },
      "rollback_policy": {
        "rollback_required": false,
        "rollback_kind": "none",
        "replay_supported": true
      },
      "execution_policy": {
        "dry_run_supported": false,
        "idempotency_key_required": false,
        "rate_limit_policy": null,
        "timeout_seconds": null
      },
      "notes": "reveal_behavior=reveals_decision_memory | conditional_approval=required if policy/security/release decisions are marked restricted | audit_summary_fields=actor,agent_id,project,tags,status,limit,result_count,redaction_summary | redaction_requirements=redact_secrets_before_output | retention_requirements=read_does_not_change_retention"
    },
    {
      "surface_id": "wasurezu.supersede_decision",
      "surface_type": "mcp_tool",
      "display_name": "supersede_decision",
      "description": "Replace an old decision with a new decision while preserving history.",
      "capability_classes": [
        "write"
      ],
      "risk_level": "medium",
      "boundary": {
        "standalone_required": true,
        "state_owner": "wasurezu",
        "execution_owner": "wasurezu",
        "policy_owner": "wasurezu",
        "audit_owner": "wasurezu",
        "interop_modes": [
          "none"
        ],
        "allowed_dependencies": [],
        "forbidden_dependencies": [
          "direct_db_write",
          "shared_internal_state",
          "shared_credentials"
        ],
        "direct_db_access_to_other_products": false,
        "receiving_product_revalidates": false
      },
      "resource_scope": {
        "tenant_scoped": false,
        "resource_patterns": [
          "decision",
          "project"
        ],
        "data_categories": [
          "decision_memory"
        ]
      },
      "identity_requirements": {
        "actor_required": true,
        "agent_id_required": true,
        "human_user_required": false,
        "service_account_allowed": true
      },
      "context_requirements": {
        "context_pack_required": false,
        "required_labels": [],
        "denied_labels": [
          "private_reasoning"
        ],
        "prompt_injection_check_required": false
      },
      "memory_requirements": {
        "recovery_pack_required": false,
        "approval_note_required": false,
        "human_intent_ref_required": false
      },
      "approval_policy": {
        "approval_required": false,
        "approver_role": null,
        "approval_ttl_seconds": null,
        "reuse_allowed": false
      },
      "audit_policy": {
        "audit_required": true,
        "input_summary_required": true,
        "output_summary_required": true,
        "mutation_summary_required": true,
        "egress_summary_required": false,
        "redaction_required": true
      },
      "rollback_policy": {
        "rollback_required": false,
        "rollback_kind": "compensating_action",
        "replay_supported": false
      },
      "execution_policy": {
        "dry_run_supported": false,
        "idempotency_key_required": false,
        "rate_limit_policy": null,
        "timeout_seconds": null
      },
      "notes": "reveal_behavior=reveals_superseded_and_new_decision_summary | conditional_approval=required when replacing architecture authority, release policy, security policy, or governance decisions | audit_summary_fields=actor,agent_id,project,old_decision_id,new_decision_id,reason,tags | redaction_requirements=redact_secrets_before_output,preserve_history_without_private_reasoning | retention_requirements=supersession_preserves_history"
    },
    {
      "surface_id": "wasurezu.save_task_state",
      "surface_type": "mcp_tool",
      "display_name": "save_task_state",
      "description": "Persist current task state, progress, files, and next steps.",
      "capability_classes": [
        "write"
      ],
      "risk_level": "medium",
      "boundary": {
        "standalone_required": true,
        "state_owner": "wasurezu",
        "execution_owner": "wasurezu",
        "policy_owner": "wasurezu",
        "audit_owner": "wasurezu",
        "interop_modes": [
          "none"
        ],
        "allowed_dependencies": [],
        "forbidden_dependencies": [
          "direct_db_write",
          "shared_internal_state",
          "shared_credentials"
        ],
        "direct_db_access_to_other_products": false,
        "receiving_product_revalidates": false
      },
      "resource_scope": {
        "tenant_scoped": false,
        "resource_patterns": [
          "task_state",
          "project",
          "file_ref"
        ],
        "data_categories": [
          "task_memory",